SQL> CREATE TABLE dept05
  2  AS SELECT * FROM dept;

테이블이 생성되었습니다.

SQL> DESC dept05;
 이름                                                  널?      유형
 ----------------------------------------------------- -------- ------------------------------------
 DEPTNO                                                         NUMBER(2)
 DNAME                                                          VARCHAR2(14)
 LOC                                                            VARCHAR2(13)

SQL> SELECT * FROM dept05;

    DEPTNO DNAME          LOC                                                                       
---------- -------------- -------------                                                             
        10 ACCOUNTING     NEW YORK                                                                  
        20 RESEARCH       DALLAS                                                                    
        30 SALES          CHICAGO                                                                   
        40 OPERATIONS     BOSTON                                                                    

SQL> 
SQL> DELETE FROM dept05;

4 행이 삭제되었습니다.

SQL> SELECT * FROM dept05;

선택된 레코드가 없습니다.

SQL> CREATE TABLE dept06
  2  AS SELECT * FROM dept;

테이블이 생성되었습니다.

SQL> DESC dept06;
 이름                                                  널?      유형
 ----------------------------------------------------- -------- ------------------------------------
 DEPTNO                                                         NUMBER(2)
 DNAME                                                          VARCHAR2(14)
 LOC                                                            VARCHAR2(13)

SQL> SELECT * FROM dept06;

    DEPTNO DNAME          LOC                                                                       
---------- -------------- -------------                                                             
        10 ACCOUNTING     NEW YORK                                                                  
        20 RESEARCH       DALLAS                                                                    
        30 SALES          CHICAGO                                                                   
        40 OPERATIONS     BOSTON                                                                    

SQL> DELETE FROM dept06
  2  WHERE deptno=30;

1 행이 삭제되었습니다.

SQL> SELECT * FROM dept06;

    DEPTNO DNAME          LOC                                                                       
---------- -------------- -------------                                                             
        10 ACCOUNTING     NEW YORK                                                                  
        20 RESEARCH       DALLAS                                                                    
        40 OPERATIONS     BOSTON                                                                    

SQL> CREATE TABLE emp09
  2  AS SELECT * FROM emp;

테이블이 생성되었습니다.

SQL> DESC ex09;
ERROR:
ORA-04043: ex09 객체는 존재하지 않습니다. 


SQL> DESC emp09;
 이름                                                  널?      유형
 ----------------------------------------------------- -------- ------------------------------------
 EMPNO                                                          NUMBER(4)
 ENAME                                                          VARCHAR2(10)
 JOB                                                            VARCHAR2(9)
 MGR                                                            NUMBER(4)
 HIREDATE                                                       DATE
 SAL                                                            NUMBER(7,2)
 COMM                                                           NUMBER(7,2)
 DEPTNO                                                         NUMBER(2)

SQL> SELECT * FROM emp09;

     EMPNO ENAME      JOB              MGR HIREDATE        SAL       COMM     DEPTNO                
---------- ---------- --------- ---------- -------- ---------- ---------- ----------                
      7369 SMITH      CLERK           7902 80/12/17        800                    20                
      7499 ALLEN      SALESMAN        7698 81/02/20       1600        300         30                
      7521 WARD       SALESMAN        7698 81/02/22       1250        500         30                
      7566 JONES      MANAGER         7839 81/04/02       2975                    20                
      7654 MARTIN     SALESMAN        7698 81/09/28       1250       1400         30                
      7698 BLAKE      MANAGER         7839 81/05/01       2850                    30                
      7782 CLARK      MANAGER         7839 81/06/09       2450                    10                
      7788 SCOTT      ANALYST         7566 87/04/19       3000                    20                
      7839 KING       PRESIDENT            81/11/17       5000                    10                
      7844 TURNER     SALESMAN        7698 81/09/08       1500          0         30                
      7876 ADAMS      CLERK           7788 87/05/23       1100                    20                
      7900 JAMES      CLERK           7698 81/12/03        950                    30                
      7902 FORD       ANALYST         7566 81/12/03       3000                    20                
      7934 MILLER     CLERK           7782 82/01/23       1300                    10                

14 개의 행이 선택되었습니다.

SQL> SELECT deptno FROM dept WHERE dname='SALES';

    DEPTNO                                                                                          
----------                                                                                          
        30                                                                                          

SQL> DELETE FROM emp09
  2  WHERE deptno=(SELECT deptno FROM dept WHERE dname='SALES');

6 행이 삭제되었습니다.

SQL> SELECT * FROM emp09;

     EMPNO ENAME      JOB              MGR HIREDATE        SAL       COMM     DEPTNO                
---------- ---------- --------- ---------- -------- ---------- ---------- ----------                
      7369 SMITH      CLERK           7902 80/12/17        800                    20                
      7566 JONES      MANAGER         7839 81/04/02       2975                    20                
      7782 CLARK      MANAGER         7839 81/06/09       2450                    10                
      7788 SCOTT      ANALYST         7566 87/04/19       3000                    20                
      7839 KING       PRESIDENT            81/11/17       5000                    10                
      7876 ADAMS      CLERK           7788 87/05/23       1100                    20                
      7902 FORD       ANALYST         7566 81/12/03       3000                    20                
      7934 MILLER     CLERK           7782 82/01/23       1300                    10                

8 개의 행이 선택되었습니다.

SQL> SELECT * FROM emp09;

     EMPNO ENAME      JOB              MGR HIREDATE        SAL       COMM     DEPTNO                
---------- ---------- --------- ---------- -------- ---------- ---------- ----------                
      7369 SMITH      CLERK           7902 80/12/17        800                    20                
      7566 JONES      MANAGER         7839 81/04/02       2975                    20                
      7782 CLARK      MANAGER         7839 81/06/09       2450                    10                
      7788 SCOTT      ANALYST         7566 87/04/19       3000                    20                
      7839 KING       PRESIDENT            81/11/17       5000                    10                
      7876 ADAMS      CLERK           7788 87/05/23       1100                    20                
      7902 FORD       ANALYST         7566 81/12/03       3000                    20                
      7934 MILLER     CLERK           7782 82/01/23       1300                    10                

8 개의 행이 선택되었습니다.

SQL> CREATE TABLE emp10
  2  AS
  3  SELECT * FROM emp;

테이블이 생성되었습니다.

SQL> DESC emp10;
 이름                                                  널?      유형
 ----------------------------------------------------- -------- ------------------------------------
 EMPNO                                                          NUMBER(4)
 ENAME                                                          VARCHAR2(10)
 JOB                                                            VARCHAR2(9)
 MGR                                                            NUMBER(4)
 HIREDATE                                                       DATE
 SAL                                                            NUMBER(7,2)
 COMM                                                           NUMBER(7,2)
 DEPTNO                                                         NUMBER(2)

SQL> 
SQL> SELECT * FROM emp10;

     EMPNO ENAME      JOB              MGR HIREDATE        SAL       COMM     DEPTNO                
---------- ---------- --------- ---------- -------- ---------- ---------- ----------                
      7369 SMITH      CLERK           7902 80/12/17        800                    20                
      7499 ALLEN      SALESMAN        7698 81/02/20       1600        300         30                
      7521 WARD       SALESMAN        7698 81/02/22       1250        500         30                
      7566 JONES      MANAGER         7839 81/04/02       2975                    20                
      7654 MARTIN     SALESMAN        7698 81/09/28       1250       1400         30                
      7698 BLAKE      MANAGER         7839 81/05/01       2850                    30                
      7782 CLARK      MANAGER         7839 81/06/09       2450                    10                
      7788 SCOTT      ANALYST         7566 87/04/19       3000                    20                
      7839 KING       PRESIDENT            81/11/17       5000                    10                
      7844 TURNER     SALESMAN        7698 81/09/08       1500          0         30                
      7876 ADAMS      CLERK           7788 87/05/23       1100                    20                
      7900 JAMES      CLERK           7698 81/12/03        950                    30                
      7902 FORD       ANALYST         7566 81/12/03       3000                    20                
      7934 MILLER     CLERK           7782 82/01/23       1300                    10                

14 개의 행이 선택되었습니다.

SQL> 
SQL> 
SQL> 
SQL> 
SQL> 
SQL> 
SQL> clear screen

SQL> CREATE TABLE emp11
  2  AS
  3  SELECT * FROM emp WHERE job='MANAGER';

테이블이 생성되었습니다.

SQL> DESC emp11;
 이름                                                  널?      유형
 ----------------------------------------------------- -------- ------------------------------------
 EMPNO                                                          NUMBER(4)
 ENAME                                                          VARCHAR2(10)
 JOB                                                            VARCHAR2(9)
 MGR                                                            NUMBER(4)
 HIREDATE                                                       DATE
 SAL                                                            NUMBER(7,2)
 COMM                                                           NUMBER(7,2)
 DEPTNO                                                         NUMBER(2)

SQL> SELECT * FROM emp11;

     EMPNO ENAME      JOB              MGR HIREDATE        SAL       COMM     DEPTNO                
---------- ---------- --------- ---------- -------- ---------- ---------- ----------                
      7566 JONES      MANAGER         7839 81/04/02       2975                    20                
      7698 BLAKE      MANAGER         7839 81/05/01       2850                    30                
      7782 CLARK      MANAGER         7839 81/06/09       2450                    10                

SQL> UPDATE emp11 SET job='TEST';

3 행이 갱신되었습니다.

SQL> SELECT * FROM emp11;

     EMPNO ENAME      JOB              MGR HIREDATE        SAL       COMM     DEPTNO                
---------- ---------- --------- ---------- -------- ---------- ---------- ----------                
      7566 JONES      TEST            7839 81/04/02       2975                    20                
      7698 BLAKE      TEST            7839 81/05/01       2850                    30                
      7782 CLARK      TEST            7839 81/06/09       2450                    10                

SQL> INSERT INTO emp11
  2  VALUES(8000, 'CODE', 'TOP', 7566, '2019/12/18', 1200, 10, 20);

1 개의 행이 만들어졌습니다.

SQL> SELECT * FROM emp11;

     EMPNO ENAME      JOB              MGR HIREDATE        SAL       COMM     DEPTNO                
---------- ---------- --------- ---------- -------- ---------- ---------- ----------                
      7566 JONES      TEST            7839 81/04/02       2975                    20                
      7698 BLAKE      TEST            7839 81/05/01       2850                    30                
      7782 CLARK      TEST            7839 81/06/09       2450                    10                
      8000 CODE       TOP             7566 19/12/18       1200         10         20                

SQL> MERGE INTO emp10
  2  USING emp11
  3  ON(emp10.empno=emp11.empno)
  4  WHEN MATCHED THEN
  5  UPDATE SET emp10.ename=emp11.ename,
  6  	emp10.job=emp11.job,
  7  	emp10.mgr=emp11.mgr,
  8  	emp10.hiredate=emp11.hiredate,
  9  	emp10.sal=emp11.sal,
 10  	emp10.comm=emp11.comm,
 11  	emp10.deptno=emp11.deptno
 12  
SQL> WHEN NOT MATCHED THEN
SP2-0734: "WHEN NOT M..."(으)로 시작되는 알 수 없는 명령 - 나머지 줄은 무시되었습니다.
SQL> INSERT VALUES(emp11.empno, emp11.ename, emp11.job,
  2  	emp11.mgr, emp11.hiredate, emp11.sal, emp11.comm,
  3  
